file,record_index,doi,title_snippet,issue_type,issue_detail
TF.ris,310,10.1080/0951192X.2025.2563261,Cyber physical production system for smart manufacturing analytics and managemen…,missing_recommended,AB
TF.ris,311,10.1080/07373937.2026.2619480,"Spray Drying 4.0: Integrating AI, real-time monitoring, and green solvents in ph…",missing_recommended,AB
TF.ris,312,10.1080/0144929X.2026.2643461,Unveiling the strategic opportunity map for the metaverse technological developm…,missing_recommended,AB
TF.ris,313,10.1080/02697459.2026.2626791,Beyond smart cities: quantum-enabled AI for adaptive urban equity and resilience,missing_recommended,AB
TF.ris,314,10.1080/12265934.2026.2647852,"A review of the metaverse and its implications for urban environments: ethical, …",missing_recommended,AB
TF.ris,315,10.1080/13675567.2025.2552754,Advancing net-zero supply chain management: a machine learning driven review ali…,missing_recommended,AB
TF.ris,316,10.1080/02701960.2026.2662284,Creating gerotechnologists: a call to action for university-based collaboration …,missing_recommended,AB
TF.ris,317,10.1080/09537287.2025.2570209,New product development in the industry 4.0 era: a literature review and researc…,missing_recommended,AB
TF.ris,318,10.1080/14631377.2025.2587013,Digital transformation and international expansion: searching for a pattern amon…,missing_recommended,AB
TF.ris,319,10.1080/27525783.2025.2533848,Enabling Digital Twins: a simulation software perspective,missing_recommended,AB
TF.ris,320,10.1080/21693277.2025.2590672,Commissioning-based framework to enhance asset life cycles in manufacturing envi…,missing_recommended,AB
TF.ris,321,10.2147/CMAR.S563211,Matrine and Its Derivatives: Multi-Pathway Regulation in Cancer Therapy,missing_recommended,AB
TF.ris,322,10.1080/0361526X.2025.2609288,Mapping the Landscape of Digital Transformation Research: A Scientometric Analys…,missing_recommended,AB
TF.ris,323,10.1080/0144929X.2026.2621779,The persuasive effects of AI-generated digital human avatar videos in public leg…,missing_recommended,AB
TF.ris,324,10.1080/15376494.2025.2610727,Contact-driven dynamics of delaminated laminates using 3D degenerated shells,missing_recommended,AB
TF.ris,325,10.1080/0951192X.2025.2509324,Knowledge-graph-enhanced disturbance control in manufacturing systems: a state-o…,missing_recommended,AB
TF.ris,326,10.1080/13467581.2026.2652126,Construction of heritage corridors and tourism development in traditional villag…,missing_recommended,AB
TF.ris,327,10.1080/03612112.2025.2488526,Statement Sleeves,missing_recommended,AB
TF.ris,328,10.1080/1448837X.2026.2616565,A method for improving the professional ability of art design teachers based on …,missing_recommended,AB
TF.ris,329,10.1080/10589759.2025.2601323,"Advances, challenges, and future directions of UAV/drone-based active non-destru…",missing_recommended,AB
TF.ris,330,10.1080/20550340.2025.2547335,A review of physics-informed and data-driven approaches for manufacturing proces…,missing_recommended,AB
TF.ris,331,10.1080/17538157.2025.2611135,Developing an ageing adaptable emotional virtual human: an AI-based approach,missing_recommended,AB
TF.ris,332,10.1080/13683500.2025.2531455,Unfolding cognitive themes and emotion dynamics in the ‘metaverse and tourism’: …,missing_recommended,AB
TF.ris,333,10.1080/0951192X.2025.2556440,From smart manufacturing in Industry 4.0 to industrial metaverse for Industry 5.…,missing_recommended,AB
TF.ris,334,10.1080/09537325.2025.2595450,"Industrial interconnection: traceability, research status and outlook",missing_recommended,AB
TF.ris,335,10.1080/15397734.2026.2635667,Multi-fidelity surrogate modeling of fatigue cracks integrating the effects of p…,missing_recommended,AB
TF.ris,336,10.1080/02614367.2025.2607495,Why aren’t we building parks in the metaverse?,missing_recommended,AB
TF.ris,337,10.1080/01426397.2025.2562858,Digital exploration of heritage conservation for old and notable trees in Chines…,missing_recommended,AB
TF.ris,338,10.1080/00207543.2025.2555531,Operations & supply chain management: principles and practice,missing_recommended,AB
TF.ris,339,10.1080/00207543.2025.2523662,Correction,missing_recommended,AU; AB
TF.ris,340,10.1080/14786451.2026.2622726,"Beyond the grid: a decade of intelligence, interoperability, and innovation in s…",missing_recommended,AB
TF.ris,341,10.1080/10447318.2026.2651370,Cyber-Physical Technologies and Perception Intelligence: A New Approach to Inter…,missing_recommended,AB
TF.ris,342,10.1080/14649357.2025.2538458,What Are the Limits to Smart Innovation? The Digital Underground Initiative and …,missing_recommended,AB
TF.ris,343,10.1080/09544828.2025.2588547,Knowledge-based approach for resolving constraint conflicts in collaborative eng…,missing_recommended,AB
TF.ris,344,10.1080/07373937.2025.2542440,Toward sustainable post-harvest practices: A critical review of solar and wind-a…,missing_recommended,AB
TF.ris,345,10.1080/14488388.2025.2524926,Enhancing manufacturing interoperability with formal ontologies: a comparative a…,missing_recommended,AB
TF.ris,346,10.1080/19397038.2025.2551000,Human‑centric Industry 5.0 manufacturing: a multi‑level framework from design to…,missing_recommended,AB
TF.ris,347,10.1080/07900627.2025.2546005,China’s water security under a changing environment,missing_recommended,AB
TF.ris,348,10.1080/30653495.2025.2583907,Toward responsible longevity medicine: Swiss framework for healthy longevity med…,missing_recommended,AB
TF.ris,349,10.1080/02508060.2025.2528261,"Hydrosocial territories: imaginaries, materialities, and struggles over knowledg…",missing_recommended,AB
TF.ris,350,10.1080/13675567.2026.2649235,Evolution and frontiers of smart supply chain management: an LLM-Enhanced BERTop…,missing_recommended,AB
TF.ris,351,10.1080/09544828.2025.2588547,Knowledge-based approach for resolving constraint conflicts in collaborative eng…,missing_recommended,AB
TF.ris,352,10.1080/07900627.2025.2546005,China’s water security under a changing environment,missing_recommended,AB
TF.ris,353,10.1080/14488388.2025.2524926,Enhancing manufacturing interoperability with formal ontologies: a comparative a…,missing_recommended,AB
TF.ris,354,10.1080/02508060.2025.2528261,"Hydrosocial territories: imaginaries, materialities, and struggles over knowledg…",missing_recommended,AB
TF.ris,355,10.1080/19397038.2025.2551000,Human‑centric Industry 5.0 manufacturing: a multi‑level framework from design to…,missing_recommended,AB
TF.ris,356,10.1080/13675567.2026.2649235,Evolution and frontiers of smart supply chain management: an LLM-Enhanced BERTop…,missing_recommended,AB
TF.ris,357,10.2147/JMDH.S584071,A Review of the Role of Zeqi Decoction in the Treatment of Non-Small Cell Lung C…,missing_recommended,AB
TF.ris,358,10.1080/15578771.2025.2587943,"Knowledge, Training, and Skills Gaps for Emerging Construction Technologies Adop…",missing_recommended,AB
TF.ris,359,10.1080/09537287.2025.2578310,Synchronizing material flows in logistics systems: conceptual framework and rese…,missing_recommended,AB
TF.ris,360,10.1080/0951192X.2025.2501582,Assessing smart manufacturing by combining IT systems and enabling technologies …,missing_recommended,AB
TF.ris,361,10.1080/14488388.2025.2598100,A review of microelectronics as a catalyst for intelligent manufacturing: trends…,missing_recommended,AB
TF.ris,362,10.1080/00051144.2025.2565023,Multimodal machine learning framework for predicting and enhancing higher educat…,missing_recommended,AB
TF.ris,363,10.1080/09205071.2025.2545278,A new compact microstrip radial band-Pass multiplexers for IoV-over –satellite: …,missing_recommended,AB
TF.ris,364,10.1080/21681015.2025.2519369,Predictive maintenance in industrial systems: an XGBoost-based approach for fail…,missing_recommended,AB
TF.ris,365,10.1080/10667857.2026.2663512,Hydrogen-centric energy storage and conversion systems for sustainable power app…,missing_recommended,AB
TF.ris,366,10.1080/01490419.2025.2544670,Numerical modelling and mapping the dynamic pulse of Gemlik Bay for sustainable …,missing_recommended,AB
TF.ris,367,10.1080/13467581.2025.2554964,Artificial intelligence methods in science of Human Habitat: a systematic review,missing_recommended,AB
TF.ris,368,10.1080/07373937.2025.2564715,Critical review of drying processes for electrode materials: Bridging fundamenta…,missing_recommended,AB
TF.ris,369,10.1080/10168664.2026.2607264,46th Conference of Slovenian Structural Engineers,missing_recommended,AU; AB
TF.ris,370,10.2147/BCTT.S586786,Recent Advances and Emerging Directions in Machine Learning-Based Breast Cancer …,missing_recommended,AB
TF.ris,371,10.1080/15623599.2025.2541715,A review on the global communication research in construction: a bibliometric pe…,missing_recommended,AB
TF.ris,372,10.1080/10589759.2026.2639670,Human-in-the-loop machine learning system for collaborative defect analysis in i…,missing_recommended,AB
TF.ris,373,10.1080/15623599.2025.2562105,The IproK ontology: a unified approach to managing construction project informat…,missing_recommended,AB
TF.ris,374,10.1080/17508975.2025.2582523,A CityJSON-based framework for versioning and traceability in asset lifecycle ma…,missing_recommended,AB
TF.ris,375,10.1080/00207543.2025.2575844,Modular and reconfigurable factories for continuous production innovation in pha…,missing_recommended,AB
TF.ris,376,10.1080/07373937.2025.2567033,Enhancement of freeze-drying technology using electromagnetic fields and artific…,missing_recommended,AB
TF.ris,377,10.1080/15228959.2025.2568662,3D scanning in academic libraries part 1: Fundamentals of 3D scanning,missing_recommended,AB
TF.ris,378,10.1080/87559129.2026.2619563,Smart Pasteurization and Sterilization by Physical Field Based on Artificial Int…,missing_recommended,AB
TF.ris,379,10.1080/00207543.2026.2615814,Reviewing lean manufacturing and Industry 4.0 technologies in the supply chain,missing_recommended,AB
TF.ris,380,10.1080/15265161.2026.2649234,"Use of AI as a Research Recruitment Tool: Ethical Elements, Considerations, and …",missing_recommended,AB
TF.ris,381,10.1080/07373937.2025.2540729,Role of AI and machine learning in advancing dryer design and scale-up,missing_recommended,AB
TF.ris,382,10.1080/03639045.2026.2649846,Generative artificial intelligence and large language models in pharmaceutical f…,missing_recommended,AB
TF.ris,383,10.1080/13467581.2025.2572487,Historic building information modelling: history research hotspots and emerging …,missing_recommended,AB
TF.ris,384,10.1080/17452759.2026.2640792,"Heterogeneous mechanical metamaterials: design paradigms, additive manufacturing…",missing_recommended,AB
TF.ris,385,10.1080/00207543.2025.2514253,Defining a research agenda for Industry 4.0 technologies in corporate strategies…,missing_recommended,AB
TF.ris,386,10.1080/13467581.2025.2574571,Machine learning (ML) and deep learning (DL) in sustainable concrete constructio…,missing_recommended,AB
TF.ris,387,10.1080/0886022X.2026.2641853,A multimodal predictive model incorporating transcriptomic-guided blood biomarke…,missing_recommended,AB
TF.ris,388,10.1080/00295450.2025.2466137,A Reinforcement Learning Approach to Augment Conventional PID Control in Nuclear…,missing_recommended,AB
TF.ris,389,10.1080/27525783.2026.2656042,Exploring the transition from BIM to Digital Twins in construction cost manageme…,missing_recommended,AB
TF.ris,390,10.1080/17460441.2025.2556863,In silico trials in ocular drug development: a new frontier in ophthalmology,missing_recommended,AB
TF.ris,391,10.1080/00295450.2025.2610157,Resilience Governance in Nuclear Safety: Insights from China’s AI-Driven Innovat…,missing_recommended,AB
TF.ris,392,10.1080/13675567.2025.2584309,Leveraging AI and blockchain for GVC resilience: a case study approach,missing_recommended,AB
TF.ris,393,10.1080/09544828.2026.2617800,A multi-domain data-driven and multiscale 1DCNN-based ensemble learning method f…,missing_recommended,AB
TF.ris,394,10.1080/17517575.2025.2588755,"Business Intelligence for SMEs: a hybrid review of models, barriers, and future …",missing_recommended,AB
TF.ris,395,10.1080/00423114.2025.2516102,Calculation of the design horizontal geometry of a railway track using inertial …,missing_recommended,AB
TF.ris,396,10.1080/15623599.2025.2520402,A virtual platform for managing building inspections during the construction of …,missing_recommended,AB
TF.ris,397,10.1080/00295639.2025.2561324,Quantifying the Effect of Material Aging on the Performance and Reliability of P…,missing_recommended,AB
TF.ris,398,10.1080/03772063.2025.2505106,AI-Powered Robotic Cloud Automation-Based Dynamic Task Allocation and Process Op…,missing_recommended,AB
TF.ris,399,10.1080/2331186X.2026.2635785,Design and application of an integrated metaverse-based immersive learning envir…,missing_recommended,AB
TF.ris,400,10.1080/10447318.2026.2621281,Align-Box: Enable Fast Bare-Hand Multi-Object Alignment in VR,missing_recommended,AB
TF.ris,401,10.1080/2331186X.2026.2635785,Design and application of an integrated metaverse-based immersive learning envir…,missing_recommended,AB
TF.ris,402,10.1080/10447318.2026.2621281,Align-Box: Enable Fast Bare-Hand Multi-Object Alignment in VR,missing_recommended,AB
TF.ris,403,10.1080/15732479.2025.2592270,Revisting the role of transport in the whole life cycle carbon emissions of civi…,missing_recommended,AB
TF.ris,404,10.1080/24705314.2026.2616863,Multi-phase forensic characterization of durability failures: a case study on pa…,missing_recommended,AB
TF.ris,405,10.1080/10455752.2025.2521006,"Sustainable and Smart Cities: Governance, Economy and Society",missing_recommended,AB
TF.ris,406,10.1080/17477778.2025.2500393,A literature review of supply chain analyses integrating discrete simulation mod…,missing_recommended,AB
TF.ris,407,10.1080/13675567.2026.2613896,Mapping the knowledge landscape of blockchain in logistics: a bibliometric analy…,missing_recommended,AB
TF.ris,408,10.1080/00207543.2025.2573194,Purposeful decision-support with Digital Shadows: a model catalog architecture a…,missing_recommended,AB
TF.ris,409,10.1080/19361610.2025.2518383,An AI-Based Cyber Ranges to Strengthen the Cybersecurity of Cyber Physical Syste…,missing_recommended,AB
TF.ris,410,10.1080/19368623.2025.2577338,Metaverse applications in hotel chains: value creation and value capture mechani…,missing_recommended,AB
TF.ris,411,10.1080/10168664.2025.2565049,IABSE Congress Incheon 2026 Structural Engineering Towards Evolution and Hyper-E…,missing_recommended,AU; AB
TF.ris,412,10.1080/00207543.2025.2584730,A blockchain-enabled Cyber-Physical System solution for decentralised smart fact…,missing_recommended,AB
TF.ris,413,10.1080/13467581.2025.2552448,Artificial intelligence in Smart Buildings: a bibliometrics-based visualization …,missing_recommended,AB
TF.ris,414,10.1080/15623599.2026.2631156,Critical performance indicators of public infrastructure projects in the Fourth …,missing_recommended,AB
TF.ris,415,10.1080/00405000.2025.2520431,Digital restoration of traditional huizhou clothing based on 3D modeling and vir…,missing_recommended,AB
TF.ris,416,10.1080/15623599.2026.2631161,Exploring the determinants of smart construction technology adoption intention: …,missing_recommended,AB
TF.ris,417,10.1080/00207543.2026.2656950,Jidoka just-in-time cycle – from genba kaizen to the introduction of artificial …,missing_recommended,AB
TF.ris,418,10.1080/19942060.2025.2598890,A physics-guided modular deep learning framework for scalable flow state predict…,missing_recommended,AB
TF.ris,419,10.1080/21642583.2026.2622131,A comprehensive survey of game-theoretic approaches for networked systems,missing_recommended,AB
TF.ris,420,10.1080/08940886.2025.2538419,LCLS Big Data Handling – How I Learned to Stop Worrying and Love the Data Deluge,missing_recommended,AB
TF.ris,421,10.1080/10447318.2025.2551048,Affective Computing-Driven Optimization Methods for Adaptive Foreign Language Le…,missing_recommended,AB
TF.ris,422,10.1080/00038628.2025.2530614,Building information modeling applications in off-site construction: a comprehen…,missing_recommended,AB
TF.ris,423,10.1080/17452007.2025.2527415,Comprehensive literature review: advancing sustainable urban environments throug…,missing_recommended,AB
TF.ris,424,10.1080/14786451.2026.2620883,Advancing SDG-7 for affordable and clean energy: decentralized energy access pat…,missing_recommended,AB
TF.ris,425,10.1080/10168664.2025.2518690,Young Engineers Colloquium (YEC) East Asia and Germany in Tokyo 2025,missing_recommended,AU; AB
TF.ris,426,10.1080/00207721.2025.2559134,Controller modelling for situation awareness in industrial internet of things: c…,missing_recommended,AB
TF.ris,427,10.1080/15623599.2026.2636733,Real-time delay detection and risk analysis management in civil construction pro…,missing_recommended,AB
TF.ris,428,10.1080/17567505.2025.2573219,Integrating Archaeological Sites into the Urban Context of Historic City Centres,missing_recommended,AB
TF.ris,429,10.1080/15732479.2026.2633534,A systematic review of technologies and methodologies for automated bridge inspe…,missing_recommended,AB
TF.ris,430,10.1080/0144929X.2026.2651117,Understanding higher education learners’ technostress in the metaverse,missing_recommended,AB
TF.ris,431,10.1080/27525783.2026.2617706,A hard-to-measure state soft-sensing method for aircraft large-component robotic…,missing_recommended,AB
TF.ris,432,10.1080/00207543.2025.2581853,A meta-learning framework for cross-domain order scheduling in intelligent wareh…,missing_recommended,AB
TF.ris,433,10.1080/10168664.2025.2525010,Report on the IABSE Symposium Tokyo 2025—Environmentally Friendly Technologies a…,missing_recommended,AU; AB
TF.ris,434,10.1080/2331186X.2025.2588010,"Integrating Industry 4.0 in engineering education: implementation patterns, peda…",missing_recommended,AB
TF.ris,435,10.2147/EB.S555894,Artificial Intelligence in Neuro-Ophthalmology for Optic Disc Pathologies and Ne…,missing_recommended,AB
TF.ris,436,10.1080/15567036.2025.2609184,Co-optimization of photovoltaic-energy storage capacity and wireless charging in…,missing_recommended,AB
TF.ris,437,10.1080/02604027.2025.2569013,Envisioning the Human-Machine Evo-Ecosystem; Considerations for the Emergence of…,missing_recommended,AB
TF.ris,438,10.1080/00207543.2026.2655808,Research framework and evolutionary trends of smart supply chain in industry 4.0…,missing_recommended,AB
TF.ris,439,10.1080/10447318.2025.2537783,"Validation of DigiMoCA, A Conversational Agent for the Cognitive Assessment of S…",missing_recommended,AB
TF.ris,440,10.1080/00207543.2026.2623538,A data-driven integrated framework for collaborative prediction and optimisation…,missing_recommended,AB
TF.ris,441,10.1080/03081079.2025.2507828,Blockchain-based multi-objective optimal allocation of shared manufacturing reso…,missing_recommended,AB
TF.ris,442,10.1080/10589759.2025.2583256,Adaptive multi-scale Laplace wavelet weighted fusion framework for heavy haul fr…,missing_recommended,AB
TF.ris,443,10.1080/19325037.2025.2529789,Evidence to Action: Revolutionizing the Community Guide Through Artificial Intel…,missing_recommended,AB
TF.ris,444,10.1080/15623599.2026.2632970,Optimal scheduling of off-site construction supply chains under uncertainty usin…,missing_recommended,AB
TF.ris,445,10.1080/00207721.2025.2562188,Sampled extended state control for a high precision robotic manipulator using ma…,missing_recommended,AB
TF.ris,446,10.1080/09291016.2025.2598545,"Chronogenetic medicine: principles, engineering, and applications of circadian-b…",missing_recommended,AB
TF.ris,447,10.1080/09544828.2025.2504304,A predictive production-logistics cooperation method for service-oriented smart …,missing_recommended,AB
TF.ris,448,10.1080/00131881.2026.2642816,Trends in school building design and projects: a bibliometric analysis,missing_recommended,AB
TF.ris,449,10.1080/23311916.2025.2573853,Quality management in industrial processes: Benefits and challenges of industry …,missing_recommended,AB
TF.ris,450,10.1080/09544828.2025.2504307,Co-evolution of design research and industrial development: empirical insights f…,missing_recommended,AB
TF.ris,451,10.1080/00207543.2025.2555532,Real-time AGV cluster scheduling using attention-enhanced PPO and strategy trans…,missing_recommended,AB
TF.ris,452,10.1080/09617353.2026.2614735,Comparison of independent component analysis and principal component analysis fo…,missing_recommended,AB
TF.ris,453,10.1080/15732479.2025.2520341,A hybrid approach for damage identification of steel bridges with discrete crack…,missing_recommended,AB
TF.ris,454,10.1080/10168664.2025.2587340,PSRC Column–TSC Beam Composite System for the Hyundai Motor Group Innovation Cen…,missing_recommended,AB
TF.ris,455,10.1080/19498241.2026.2616209,CUTTING EDGE AI,missing_recommended,AB
TF.ris,456,10.1080/08982112.2025.2520227,Rejoinder to the discussion of: Industrial process analytics—multiscale approach…,missing_recommended,AB
TF.ris,457,10.1080/00405000.2026.2622882,From Loom to Algorithm: How Digital Technologies Drive Quality Development in th…,missing_recommended,AB
TF.ris,458,10.1080/0951192X.2026.2622987,Sustainable smart manufacturing through digital Servitization: a systematic lite…,missing_recommended,AB
TF.ris,459,10.1080/15732479.2025.2608060,Improving the decision-making and planning of future railway bridge intervention…,missing_recommended,AB
TF.ris,460,10.1080/13640461.2025.2496605,Unlocking the alchemy: an analysis of stainless steel creation via fused filamen…,missing_recommended,AB
TF.ris,461,10.1080/13675567.2025.2582511,Enhanced route scheduling simulation – a comparative analysis of distribution mi…,missing_recommended,AB
TF.ris,462,10.1080/00295450.2025.2538280,Guidance for Developing Digital-Twins for Online Condition Monitoring of Nuclear…,missing_recommended,AB
TF.ris,463,10.1080/00207543.2025.2483113,Stress tests for supply chains: towards resilience and viability,missing_recommended,AB
TF.ris,464,10.1080/09613218.2025.2567323,Impact of architectural design characteristics of railway stations on travellers…,missing_recommended,AB
TF.ris,465,10.1080/10447318.2025.2526573,System Architecture Change in the Context of Double-Directional Human-AI Cogniti…,missing_recommended,AB
TF.ris,466,10.1080/13675567.2025.2514039,What drives the adoption of digital food supply chains? assessing the intentions…,missing_recommended,AB
TF.ris,467,10.1080/0895769X.2025.2573123,How to Understand AI Literature from the Perspective of Ethical Literary Critici…,missing_recommended,AB
TF.ris,468,10.1080/15623599.2026.2648080,Does building information modelling facilitate extended producer responsibility:…,missing_recommended,AB
TF.ris,469,10.1080/03772063.2025.2559731,Optimised 5G MIMO-D2D Communication Model for Immersive Educational Tourism: A C…,missing_recommended,AB
TF.ris,470,10.1080/21693277.2025.2582472,Reinforcement learning based dispatching solutions in semiconductor manufacturin…,missing_recommended,AB
TF.ris,471,10.1080/23311975.2026.2646401,Business analytics adoption framework for oil and gas surface facilities managem…,missing_recommended,AB
TF.ris,472,10.1080/09553002.2025.2595632,"Development of ecocentric radiation protection: issues, challenges and approache…",missing_recommended,AB
TF.ris,473,10.1080/13803395.2025.2601390,Neuropsychological sequelae of cancer and cancer therapy,missing_recommended,AB
TF.ris,474,10.1080/13675567.2026.2651844,A systematic review of cold chain logistics performance for fresh agricultural p…,missing_recommended,AB
TF.ris,475,10.1080/23249935.2026.2631152,"A survey of large language models in transportation planning: modelling, design …",missing_recommended,AB
TF.ris,476,10.1080/17512549.2025.2539120,Application of Internet of Things in assessing personal thermal comfort incorpor…,missing_recommended,AB
TF.ris,477,10.1080/13614576.2025.2515051,The Evolution of Design Technologies in the Digital Preservation of Cultural Her…,missing_recommended,AB
TF.ris,478,10.2147/VHRM.S555592,Artificial Intelligence in Cerebrovascular Disease Management: A Comprehensive R…,missing_recommended,AB
TF.ris,479,10.1080/17538947.2025.2528617,Data-driven structural damage monitoring and assessment based on unmanned aerial…,missing_recommended,AB
TF.ris,480,10.1080/23311975.2026.2612775,Digital transformation and innovation in small and medium enterprises (SMEs): a …,missing_recommended,AB
TF.ris,481,10.1080/10408398.2025.2597289,Fat replacement and reduction strategies for plant-based foods,missing_recommended,AB
TF.ris,482,10.2147/COPD.S568919,Innovative Applications and Challenges of Artificial Intelligence in the Whole-C…,missing_recommended,AB
TF.ris,483,10.1080/08940886.2026.2649097,Agentic AI for User Facilities: Workshop Report,missing_recommended,AB
TF.ris,484,10.1080/15567036.2026.2633194,Research on structured FCN algorithm for combustion chamber temperature field pr…,missing_recommended,AB
TF.ris,485,10.2147/IJN.S568254,Nanotechnology-Driven Cancer Therapies for Precision Oncology: Advances and Clin…,missing_recommended,AB
TF.ris,486,10.1080/10168664.2026.2610088,IABSE Technical Committee Activities,missing_recommended,AU; AB
TF.ris,487,10.1080/00207543.2025.2539307,Towards resilient product-service systems in Industry 5.0: a self-adaptive resil…,missing_recommended,AB
TF.ris,488,10.1080/17538157.2026.2655820,Application of artificial intelligence chatbots in the medical field: latent dir…,missing_recommended,AB
TF.ris,489,10.1080/09544828.2025.2558339,A hierarchical distillation network based on data-derived multi-domain feature p…,missing_recommended,AB
