file,record_index,doi,title_snippet,issue_type,issue_detail
T7_Scopus.ris,157,,From Then to Now: Digital Asset Management on Aging Port Infrastructure,missing_recommended,DO
T7_Scopus.ris,173,,Embedded IR multi aperture imaging for surveillance applications,missing_recommended,DO
T7_Scopus.ris,185,,Mooring Line Failures: Considerations for the Installation of Barrier Protection,missing_recommended,DO
T7_Scopus.ris,218,,BLOCKCHAIN TECHNOLOGY FOR TRACEABILITY OF HAZARDOUS MATERIAL IN SEAPORTS,missing_recommended,DO
T7_Scopus.ris,223,,Future maintenance: Transitioning from digitalisation to industry 4.0,missing_recommended,DO
T7_Scopus.ris,225,,Remote Monitoring System and Controller for the Construction Machinery using AR …,missing_recommended,DO
T7_Scopus.ris,269,,Research and Design Multifunctional Marine Buoys for Environmental Monitoring of…,missing_recommended,DO
T7_Scopus.ris,272,,The Digital Evolution of the Maritime Industry: Unleashing the Power of IoT and …,missing_recommended,DO
T7_Scopus.ris,276,,"AN INNOVATIVE APPROACH TO PORT MONITORING: DIGITAL TWIN, STRATEGIC DECISION SYST…",missing_recommended,DO
T7_Scopus.ris,296,,Shape control of variable guide frame for tunnel wall inspection,missing_recommended,DO
T7_Scopus.ris,303,,Unmanned full processing platforms; Using subsea technology as enabler,missing_recommended,DO
T7_Scopus.ris,324,,Port and vessel insights from IoT edge vessel motion measurement devices,missing_recommended,DO
T7_Scopus.ris,343,,New Technologies in Small and Medium-sized Ports: Its Impacts on the Future of W…,missing_recommended,DO
T7_Scopus.ris,368,,AI-based Monitoring of Coastal and Marine Environments,missing_recommended,DO
T7_Scopus.ris,388,,MobDesctop: A Mobile decision support application for monitoring real-time conta…,missing_recommended,DO
T7_Scopus.ris,400,,Data-driven Deep Learning for Proactive Terminal Process Management,missing_recommended,DO
T7_Scopus.ris,403,,Digital Port Asset Management System (PAMS): A Predictive Framework for Data-Dri…,missing_recommended,DO
T7_Scopus.ris,404,,Analysis of high time-resolution measurement of gaseous and particulate pollutio…,missing_recommended,DO
T7_Scopus.ris,418,,An iot based system predictive maintenance and operations scheduling system for …,missing_recommended,DO
T7_Scopus.ris,443,,Smart Port Concept: A Case Study Of Port-Integrated Autonomous Networks,missing_recommended,DO
T7_Scopus.ris,463,,Quality Metocean Data - Methods to Improve Real-Time Outcomes,missing_recommended,DO
T8_IEEE.ris,1,10.1109/ACCESS.2022.3182491,Retrofitting-Based Development of Brownfield Industry 4.0 and Industry 5.0 Solut…,missing_recommended,T2
T8_IEEE.ris,2,10.1109/IHTC61819.2024.10855009,Integrating Industry 4.0 approaches into Low Voltage Grids: A Cost-Efficient Ret…,missing_recommended,T2
T8_IEEE.ris,3,10.1109/ICIT46573.2021.9453558,Concepts for Retrofitting Industrial Programmable Logic Controllers for Industri…,missing_recommended,T2
T8_IEEE.ris,4,10.1109/CSCC55931.2022.00041,A feasibility study on regeneration capture on a seaport electrified gantry cran…,missing_recommended,T2
T8_IEEE.ris,5,10.1109/ETFA46521.2020.9211999,Enabling IoT connectivity for ModbusTCP sensors,missing_recommended,T2
T8_IEEE.ris,6,10.1109/MIPRO60963.2024.10569463,Conventional Approach versus State-of-Charge Feedback for Lithium Titanate Batte…,missing_recommended,T2
T8_IEEE.ris,7,10.1109/ECTIDAMTNCON64748.2025.10962086,Development and Integration of an Industrial Automation System based on the MQTT…,missing_recommended,T2
T8_IEEE.ris,8,10.1109/ACCESS.2025.3612701,Analyzing Microservice Communication Performance in Industrial Edge Platform,missing_recommended,T2
T8_IEEE.ris,9,10.1109/ACSOS-C66519.2025.00036,A Hybrid Architecture for an Autonomous Maritime Water-Taxi Fleet,missing_recommended,T2
T8_IEEE.ris,10,10.1109/EuCNC/6GSummit60053.2024.10597059,Designing a dynamic platform for the next generation of multi-modal logistics,missing_recommended,T2
T8_IEEE.ris,11,10.1109/ETFA65518.2025.11205604,CPSWatch: Lightweight Ontology for System Description and Diagnosis,missing_recommended,T2
T8_IEEE.ris,12,10.1109/SSCI50451.2021.9659946,Meeting Demands for Mass Customization: A Hybrid Organic Computing Approach,missing_recommended,T2
T8_IEEE.ris,13,10.1109/NCC52529.2021.9530062,On Traffic Classification in Enterprise Wireless Networks,missing_recommended,T2
T8_Scopus.ris,FILE,,,file_error,line 1: Malformed line: ﻿TY  - Article
T8_Scopus.ris,FILE,,,file_error,"line 2: Field outside record: AU  - Alwis, N. De"
T8_Scopus.ris,FILE,,,file_error,line 3: Field outside record: TI  - A way towards port automation: challenges and implications
T8_Scopus.ris,FILE,,,file_error,line 4: Field outside record: JF  - Wmu Journal of Maritime Affairs
T8_Scopus.ris,FILE,,,file_error,line 5: Field outside record: DO  - 10.1007/s13437-024-00350-9
T8_Scopus.ris,FILE,,,file_error,line 6: Field outside record: SN  - 1651-436X
T8_Scopus.ris,FILE,,,file_error,line 7: Field outside record: UR  - https://www.scopus.com/inward/record.uri?partnerID=HzOxMe3b&scp=8521018395
T8_Scopus.ris,FILE,,,file_error,line 8: Field outside record: PY  - 2025///
T8_Scopus.ris,FILE,,,file_error,line 9: Field outside record: VL  - 24
T8_Scopus.ris,FILE,,,file_error,line 10: Field outside record: IS  - 2
T8_Scopus.ris,FILE,,,file_error,line 11: Field outside record: SP  - 225
T8_Scopus.ris,FILE,,,file_error,line 12: Field outside record: EP  - 247
T8_Scopus.ris,FILE,,,file_error,line 13: Field outside record: M1  - Query date: 2026-05-15 12:12:07
T8_Scopus.ris,FILE,,,file_error,line 14: Field outside record: M1  - 7 cites: https://www.scopus.com/inward/citedby.uri?partnerID=HzOxMe3b&scp=
T8_Scopus.ris,FILE,,,file_error,line 15: Field outside record: N1  - Cited By (since 2025): 7
T8_Scopus.ris,FILE,,,file_error,line 16: ER  - without matching TY
T8_Scopus.ris,1,10.1016/j.procs.2025.07.089,"Smart gate model in a maritime container port: Processes, technologies and infor…",missing_recommended,T2; AB
T8_Scopus.ris,2,10.3390/jmse14020154,Three-Dimensional Scanning-Based Retrofitting of Ballast Water Treatment Systems…,missing_recommended,T2; AB
T8_Scopus.ris,3,10.1109/DSAA65442.2025.11248031,Cybersecurity Recommendations for Planning and Securing Port 4.0 and Maritime In…,missing_recommended,T2; AB
T8_Scopus.ris,4,10.20078/j.eep.20250205,Advances in Key Technologies and Applications for Ship Carbon Emission Reduction,missing_recommended,T2; AB
T8_Scopus.ris,5,10.3390/su18010324,"Sustainability and Smart Technology in Supply Chains, Law, and Economic Developm…",missing_recommended,T2; AB
T8_Scopus.ris,6,10.1080/08920753.2025.2590810,Sustainable Fifth-Generation Port Systems: Challenges and Opportunities for Loca…,missing_recommended,T2; AB
T8_Scopus.ris,7,,NCOS ONLINE AND THE FUTURE OF PORT OPERATIONS: INSIGHTS FROM THE DIGITAL INTEGRA…,missing_recommended,T2; AB; DO
T8_Scopus.ris,8,10.1007/978-3-032-02102-1_4,Digital Twin Framework to Enable Green Ship Operations Towards Zero Emission Ves…,missing_recommended,T2; AB
TF.ris,1,10.1080/23789689.2025.2526928,Digital Twin for resilience and sustainability assessment of port facility,missing_recommended,AB
TF.ris,2,10.12688/digitaltwin.17599.3,The development of a digital twin concept system,missing_recommended,AB
TF.ris,3,10.1080/18366503.2026.2646718,Decision-support systems in container terminal automation: a systematic review o…,missing_recommended,AB
TF.ris,4,10.1080/27525783.2025.2600763,Conceptualising the digital twin: An analysis of 358 definitions,missing_recommended,AB
TF.ris,5,10.1080/00207543.2025.2555540,Digital twin-driven real-time collaborative scheduling for U-shaped automated co…,missing_recommended,AB
TF.ris,6,10.1080/09544828.2025.2518905,Conceptual modelling method of multi-abstraction level digital twin based on ext…,missing_recommended,AB
TF.ris,7,10.1080/27525783.2026.2618303,Developing the systemic digital twin of an industrial enterprise with Σ,missing_recommended,AB
TF.ris,8,10.1080/10429247.2025.2529086,Research on the Digital Twin Application Maturity Model for Construction Project…,missing_recommended,AB
TF.ris,9,10.1080/07373937.2026.2631682,A review of digital twin applications for optimizing grain drying: Challenges an…,missing_recommended,AB
TF.ris,10,10.1080/27525783.2025.2545236,A review: digital twin application in bridge fire engineering and management,missing_recommended,AB
TF.ris,11,10.12688/digitaltwin.17830.1,A digital twin-based green construction management method for prefabricated buil…,missing_recommended,AB
TF.ris,12,10.1080/21693277.2025.2507954,Digital twin driven factory and production planning (FPP),missing_recommended,AB
TF.ris,13,10.1080/0951192X.2025.2511105,A digital twin optimization method for complex product workshop scheduling with …,missing_recommended,AB
TF.ris,14,10.1080/18366503.2026.2644703,Drivers of digital twin adoption in smart ports: a systematic review of empirica…,missing_recommended,AB
TF.ris,15,10.1080/27525783.2025.2605418,Underwater digital twin applications: a systematic literature review,missing_recommended,AB
TF.ris,16,10.1080/00207543.2026.2634971,Digital twin based cycle time prediction for robotic arm,missing_recommended,AB
TF.ris,17,10.1080/00207721.2026.2617140,Optimisation of the Kaplan hydropower system via PID2 and digital twin,missing_recommended,AB
TF.ris,18,10.1080/00207543.2026.2655025,Digital twin transition for intelligent and resilient industrial systems,missing_recommended,AB
TF.ris,19,10.1080/27525783.2026.2634493,Digital twin-based multi-view energy efficiency prediction for machining systems,missing_recommended,AB
TF.ris,20,10.1080/00405000.2025.2496840,Research status and development trends of digital twin technology in apparel pro…,missing_recommended,AB
TF.ris,21,10.1080/00207543.2025.2609943,Digital twin-driven human-machine collaborative maintenance services for continu…,missing_recommended,AB
TF.ris,22,10.1080/00051144.2025.2572148,FEDTWIN – trustworthy digital twin as a service for visually impaired,missing_recommended,AB
TF.ris,23,10.1080/0951192X.2025.2504085,Cost-effective sensor-based digital twin for fused deposition modeling 3D printe…,missing_recommended,AB
TF.ris,24,10.1080/0951192X.2025.2564781,Digital twin modelling and its evaluation method of the robotic disassembly proc…,missing_recommended,AB
TF.ris,25,10.1080/27525783.2026.2649426,A digital twin approach for vibration prediction of converter transformers,missing_recommended,AB
TF.ris,26,10.1080/27525783.2026.2618294,Semantic interoperability for digital twin-driven product development: a maturit…,missing_recommended,AB
TF.ris,27,10.1080/15732479.2026.2656943,Digital twin-driven multi-metrics condition assessment of eccentrically loaded r…,missing_recommended,AB
TF.ris,28,10.1080/27525783.2025.2512978,Digital twin assisted improved transformer multidimensional time series for faul…,missing_recommended,AB
TF.ris,29,10.1080/27525783.2025.2533863,Machine learning and digital twin assisted temperature prediction during additiv…,missing_recommended,AB
TF.ris,30,10.1080/27525783.2025.2591981,Motor fault digital twin modelling and data generation,missing_recommended,AB
TF.ris,31,10.1080/17445302.2025.2518899,Digital twin-based method for hull structural state cognition and assessment,missing_recommended,AB
TF.ris,32,10.1080/27525783.2026.2618283,A digital twin-based method for predicting the burst speed of discs,missing_recommended,AB
TF.ris,33,10.1080/0951192X.2025.2534600,Multi-dimensional digital twin for cable assembly by synthetic data and reinforc…,missing_recommended,AB
TF.ris,34,10.1080/21693277.2025.2591786,In-depth analysis of organisational structures for digital twin ecosystems,missing_recommended,AB
TF.ris,35,10.12688/digitaltwin.17913.2,Digital twin method and application practice of spacecraft system driven by mech…,missing_recommended,AB
TF.ris,36,10.1080/17480272.2025.2551742,A review of digital twin-enabled intelligent manufacturing with a focus on the w…,missing_recommended,AB
TF.ris,37,10.1080/27525783.2026.2622705,Digital twin for early-stage fault detection in a hybrid manufacturing cell,missing_recommended,AB
TF.ris,38,10.1080/10630732.2026.2634808,Smarter Participation: Co-Governance Protocol Using Urban Digital Twin and Desig…,missing_recommended,AB
TF.ris,39,10.1080/27525783.2026.2653395,Digital twin understanding and adoption in small- and medium-sized enterprises: …,missing_recommended,AB
TF.ris,40,10.1080/27525783.2025.2493074,Review on the establishment and application of digital twin model for infrared o…,missing_recommended,AB
TF.ris,41,10.12688/digitaltwin.17824.1,Quality control method of steel structure construction based on digital twin tec…,missing_recommended,AB
TF.ris,42,10.1080/27525783.2025.2545229,Research on the connotation and technical path of digital twin technology for av…,missing_recommended,AB
TF.ris,43,10.1080/0951192X.2025.2544550,A digital twin approach for online reconfiguration of robotic manufacturing syst…,missing_recommended,AB
TF.ris,44,10.1080/09603409.2026.2643937,A deep learning-based digital twin system for creep behaviour of metallic alloys,missing_recommended,AB
TF.ris,45,10.12688/digitaltwin.17732.2,Digital twin and contact analysis of ultra-long distance coiled tubing operation…,missing_recommended,AB
TF.ris,46,10.12688/digitaltwin.18083.1,Digital twin modeling method for environmental governance of abandoned landfills…,missing_recommended,AB
TF.ris,47,10.1080/07373937.2026.2631672,Digital twin-enabled multi-agent control for energy-efficient wood drying in des…,missing_recommended,AB
TF.ris,48,10.1080/27525783.2025.2534822,A digital twin for manufacturing with direct energy deposition: a stellarator in…,missing_recommended,AB
TF.ris,49,10.1080/00207543.2025.2499866,Distributed multi-robot task dynamic allocation in digital-twin factory towards …,missing_recommended,AB
TF.ris,50,10.1080/15623599.2026.2641186,A Digital Twin Environment for integrated management of highway construction,missing_recommended,AB
TF.ris,51,10.1080/00207543.2025.2512447,A digital twin-based cyber-physical system for resilient short-term equipment le…,missing_recommended,AB
TF.ris,52,10.1080/27525783.2025.2529171,Integrative modelling of SSPC for digital twin applications: coupling electromag…,missing_recommended,AB
TF.ris,53,10.1080/15732479.2026.2645822,Identification and evaluation of uncertainty sources of materials and sensors fo…,missing_recommended,AB
TF.ris,54,10.1080/0144929X.2025.2523446,Human digital twin for long-distance relationships: a scoping review,missing_recommended,AB
TF.ris,55,10.1080/00218464.2025.2535687,Adaptive digital twin framework for monitoring and predicting the performance of…,missing_recommended,AB
TF.ris,56,10.1080/00207543.2025.2590198,Digital twin-driven design and application paradigm for assembly accuracy perfor…,missing_recommended,AB
TF.ris,57,10.1080/14488388.2025.2565021,A survey of digital twin implementations for industrial transformation: analysis…,missing_recommended,AB
TF.ris,58,10.1080/14942119.2025.2500118,Toward a digital twin to improve the training and performance of forestry operat…,missing_recommended,AB
TF.ris,59,10.1080/17452759.2026.2639147,Digital twin for in – space manufacturing: a comprehensive review from framework…,missing_recommended,AB
TF.ris,60,10.1080/27525783.2025.2537841,A theoretical method to adaptive design of complex engineering systems based on …,missing_recommended,AB
TF.ris,61,10.1080/10426914.2025.2586498,Digital twin–enabled model predictive control in additive manufacturing: critica…,missing_recommended,AB
TF.ris,62,10.1080/00207543.2025.2507112,Integrating digital twin and blockchain for responsive working capital managemen…,missing_recommended,AB
TF.ris,63,10.1080/27525783.2026.2633468,A digital twin simulation framework for assessing the impact of autonomous vehic…,missing_recommended,AB
TF.ris,64,10.1080/27525783.2025.2533858,Digital twin in railway industry: a bibliometric analysis and systematic review,missing_recommended,AB
TF.ris,65,10.1080/17452759.2025.2592734,Real-time digital twin of vat-based 3D printing using in-situ ultrasonic monitor…,missing_recommended,AB
TF.ris,66,10.1080/20964471.2026.2615504,A digital twin approach for the identification and update of ecological infrastr…,missing_recommended,AB
TF.ris,67,10.1080/17508975.2025.2558616,The evolution of digital twin applications in construction and the built environ…,missing_recommended,AB
TF.ris,68,10.1080/00207543.2026.2651391,Constructed by multiple on-machine inspection: intelligent machining system driv…,missing_recommended,AB
TF.ris,69,10.1080/09544828.2025.2558336,An adaptive digital twin-based method for resilient design: a case study of high…,missing_recommended,AB
TF.ris,70,10.1080/27525783.2026.2657645,Digital twin-based identification and control of key quality characteristics in …,missing_recommended,AB
TF.ris,71,10.1080/27525783.2026.2644045,Developing a digital twin framework and smart sensors gateway for monitoring soi…,missing_recommended,AB
TF.ris,72,10.1080/19401493.2025.2504005,Development and demonstration of a digital twin platform leveraging ontologies a…,missing_recommended,AB
TF.ris,73,10.1080/17538947.2025.2520000,AnywhereXR: on-the-fly 3D environments as a basis for open source immersive digi…,missing_recommended,AB
TF.ris,74,10.1080/27525783.2025.2610579,Fatigue detection and optimisation method for human–robot collaborative assembly…,missing_recommended,AB
TF.ris,75,10.1080/17538947.2025.2509082,A digital twin-driven enhanced visualization method for high-steep slope scene,missing_recommended,AB
TF.ris,76,10.1080/19475705.2026.2652586,Simulation-driven digital twin framework for drought-risk mitigation in groundwa…,missing_recommended,AB
TF.ris,77,10.1080/27525783.2025.2599593,TCN-TOPSIS model and its application in digital twin system for rocket safety st…,missing_recommended,AB
TF.ris,78,10.1080/00207543.2025.2521717,"Computer-aided process planning, digital twin, and smart manufacturing: intercon…",missing_recommended,AB
TF.ris,79,10.1080/10298436.2025.2540076,Enhancing pavement distress segmentation model with diffusion-based generative A…,missing_recommended,AB
TF.ris,80,10.1080/27525783.2025.2598085,"Dynamic physics-based digital twin for supervisory, condition monitoring and fau…",missing_recommended,AB
TF.ris,81,10.1080/23307706.2025.2503793,Digital twin-driven few-shot fault data generation and intelligent diagnosis for…,missing_recommended,AB
TF.ris,82,10.1080/00295639.2025.2471724,First-of-a-Kind Risk-Informed Digital Twin for Operational Decision Making,missing_recommended,AB
TF.ris,83,10.1080/27525783.2025.2598492,Digital twin management platform integrating multi-agent system for resource uti…,missing_recommended,AB
TF.ris,84,10.1080/27525783.2026.2614885,The digital twin-enabled deformation prediction and control methodologies for th…,missing_recommended,AB
TF.ris,85,10.1080/27525783.2026.2640650,Digital twin-based lateral offset trajectory compensation and straightness measu…,missing_recommended,AB
TF.ris,86,10.1080/03772063.2025.2582705,Optimized Wind-Driven PMSG Energy Extraction in Low Wind Speeds with Machine Lea…,missing_recommended,AB
TF.ris,87,10.1080/15472450.2025.2553287,A “digital twin” traffic simulation tool for network-wide real-time traffic moni…,missing_recommended,AB
TF.ris,88,10.1080/17477778.2025.2531045,"Discrete event simulation-based digital twin: an approach focused on tactical, s…",missing_recommended,AB
TF.ris,89,10.1080/17538157.2026.2623489,Enhancing health monitoring in smart offices: a multi-layered digital twin appro…,missing_recommended,AB
TF.ris,90,10.1080/17477778.2025.2492682,A system dynamics-based digital twin application for mealworm farming,missing_recommended,AB
TF.ris,91,10.1080/15732479.2025.2587043,A digital twin-based system for timely simulation of bridge structural performan…,missing_recommended,AB
TF.ris,92,10.1080/09544828.2025.2504852,Conceptualisation of digital twin-enabled new product design framework for the a…,missing_recommended,AB
TF.ris,93,10.1080/27525783.2025.2570262,Dynamic adaptive mechanism for construction investment decision-making under mul…,missing_recommended,AB
TF.ris,94,10.1080/17517575.2026.2616681,Towards a Digital Twin Lifecycle Management Framework,missing_recommended,AB
TF.ris,95,10.1080/0951192X.2025.2496890,Digital twin-enhanced framework for optimizing high-mix/low-volume manufacturing,missing_recommended,AB
TF.ris,96,10.1080/00207543.2025.2543491,Digital twin-driven deep reinforcement learning for real-time optimisation in dy…,missing_recommended,AB
TF.ris,97,10.1080/27525783.2025.2565246,Systematic selection framework for digital twin development environments in smar…,missing_recommended,AB
TF.ris,98,10.1080/02286203.2025.2563984,Development of an innovative tool for clamping forces evaluation in the sheet me…,missing_recommended,AB
TF.ris,99,10.1080/10589759.2025.2524053,An non-destructive diagnostic method for complex wired networks based on distrib…,missing_recommended,AB
TF.ris,100,10.1080/0951192X.2025.2599550,Green dynamic scheduling optimization and visual monitoring system for micro-hol…,missing_recommended,AB
TF.ris,101,10.1080/07900627.2025.2544810,Digital twin technology and its application in water governance: China’s practic…,missing_recommended,AB
TF.ris,102,10.1080/17445302.2025.2505827,A digital twin model within the framework of a digital healthcare engineering sy…,missing_recommended,AB
TF.ris,103,10.1080/15623599.2026.2624416,A digital twin framework for enhancing building maintainability during the desig…,missing_recommended,AB
TF.ris,104,10.1080/00207543.2025.2552293,The risk management of customized product supply chains based on digital twin te…,missing_recommended,AB
TF.ris,105,10.1080/10589759.2025.2610726,A digital twin-driven cross-domain adaptation method for bearing intelligent fau…,missing_recommended,AB
TF.ris,106,10.1080/17452007.2025.2543813,"Transforming facility management with BIM, IoT, and Digital Twin: a data-driven …",missing_recommended,AB
TF.ris,107,10.1080/27525783.2025.2610851,"Advances, challenges and prospective research when geographical information scie…",missing_recommended,AB
TF.ris,108,10.1080/15623599.2025.2537720,The sequence of activities for Digital Twin implementation for building operatio…,missing_recommended,AB
TF.ris,109,10.1080/15623599.2025.2537727,Spatial-temporal traceability and coordination in modular integrated constructio…,missing_recommended,AB
TF.ris,110,10.1080/17499518.2026.2649027,A multidimensional digital twin framework for mine water-sand mixture inrush pre…,missing_recommended,AB
TF.ris,111,10.1080/15435075.2025.2563140,Multi-objective structural risk minimization in multi-gene genetic programming f…,missing_recommended,AB
TF.ris,112,10.1080/15623599.2026.2651946,Designing a BIM-enhanced digital twin architecture for construction pollution ma…,missing_recommended,AB
TF.ris,113,10.1080/27525783.2025.2533861,A lightweight method based on multi-axis self-attention and convolutional embedd…,missing_recommended,AB
TF.ris,114,10.1080/00295450.2026.2631248,Implementation and Demonstration of the Digital Twin Certification System Remote…,missing_recommended,AB
TF.ris,115,10.1080/09544828.2025.2540238,A SysML-flow based functional modelling approach for digital twin in smart produ…,missing_recommended,AB
TF.ris,116,10.1080/19397038.2025.2573275,Optimising energy usage of a semi-continuous fluidised bed dryer using digital t…,missing_recommended,AB
TF.ris,117,10.1080/14942119.2025.2533086,Toward a digital twin of forest roads – road weather stations for monitoring roa…,missing_recommended,AB
TF.ris,118,10.1080/00207233.2025.2539654,Predictive soil map of Slovakia: a digital twin for decision makers,missing_recommended,AB
TF.ris,119,10.1080/17445302.2025.2604253,From the titanic era to the AI era: digital healthcare engineering as a lifecycl…,missing_recommended,AB
TF.ris,120,10.1080/15732479.2025.2504535,Performance-oriented system digital twin: a Bayesian network-based framework to …,missing_recommended,AB
TF.ris,121,10.1080/00207543.2025.2524516,Do you trust digital twins? A framework to support the development of trusted di…,missing_recommended,AB
TF.ris,122,10.1080/00221686.2026.2643704,Shaping digital transition in water engineering,missing_recommended,AB
TF.ris,123,10.1080/20464177.2026.2634483,A systematic review of smart ports in global maritime trade: multi-dimensional e…,missing_recommended,AB
TF.ris,124,10.2147/JPR.S570481,Reshaping Precision Cancer Pain Management with Multimodal Artificial Intelligen…,missing_recommended,AB
TF.ris,125,10.1080/27525783.2026.2634497,Digital twins for supply chain efficiency—learning from a case study in a rail-t…,missing_recommended,AB
TF.ris,126,10.1080/27525783.2025.2562418,Machine learning and digital twins in smart irrigation: optimising water use thr…,missing_recommended,AB
TF.ris,127,10.1080/17538947.2025.2512063,Generative LOD algorithm based on space–time grid model,missing_recommended,AB
TF.ris,128,10.1080/02697459.2026.2622112,It takes two to tango: politician–planner collaboration in digital planning,missing_recommended,AB
TF.ris,129,10.1080/17452759.2025.2610146,Enabling AI-Controlled additive manufacturing with real-time multiphysics digita…,missing_recommended,AB
TF.ris,130,10.1080/27525783.2025.2588941,A web-based visual programming environment for design and operation of digital t…,missing_recommended,AB
TF.ris,131,10.1080/17445302.2025.2524022,Digital twinning method for stress field distribution of marine environment obse…,missing_recommended,AB
